{
  "$schema": "https://json-schema.org/draft/2020-12/schema",
  "$id": "https://example.invalid/o005-bridge-mastery.schema.json",
  "title": "O005 original bridge mastery layer",
  "type": "object",
  "additionalProperties": false,
  "required": [
    "schema", "schema_version", "unit_id", "language", "source",
    "provenance_policy", "article_link_catalog", "problems"
  ],
  "properties": {
    "schema": {"const": "o005-bridge-mastery-v1"},
    "schema_version": {"const": "1.0.0"},
    "unit_id": {"const": "O005-BRIDGE-C1"},
    "language": {"const": "id-ID"},
    "source": {
      "type": "object",
      "additionalProperties": false,
      "required": ["type", "spine", "not_part_of_source_book", "license"],
      "properties": {
        "type": {"const": "new_original_addition"},
        "spine": {"const": "Joceline Lega, Introduction to Mathematical Modeling, v1.01"},
        "not_part_of_source_book": {"const": true},
        "license": {"const": "CC BY-NC-SA 4.0"}
      }
    },
    "provenance_policy": {
      "type": "object",
      "additionalProperties": false,
      "required": ["model_identification", "source_author_credit_preserved", "non_endorsement"],
      "properties": {
        "model_identification": {"const": "OpenAI Codex gpt-5.6-sol, Ultra."},
        "source_author_credit_preserved": {"const": true},
        "non_endorsement": {"const": true}
      }
    },
    "article_link_catalog": {"type": "object", "maxProperties": 0},
    "problems": {
      "type": "array",
      "minItems": 7,
      "maxItems": 7,
      "uniqueItems": true,
      "prefixItems": [
        {"allOf": [{"$ref": "#/$defs/problem"}, {"properties": {"problem_id": {"const": "O005-BRIDGE-C1-P01"}, "ordinal": {"const": 1}}, "not": {"required": ["notebook"]}}]},
        {"allOf": [{"$ref": "#/$defs/problem"}, {"properties": {"problem_id": {"const": "O005-BRIDGE-C1-P02"}, "ordinal": {"const": 2}}, "not": {"required": ["notebook"]}}]},
        {"allOf": [{"$ref": "#/$defs/problem"}, {"properties": {"problem_id": {"const": "O005-BRIDGE-C1-P03"}, "ordinal": {"const": 3}}, "not": {"required": ["notebook"]}}]},
        {"allOf": [{"$ref": "#/$defs/problem"}, {"properties": {"problem_id": {"const": "O005-BRIDGE-C1-P04"}, "ordinal": {"const": 4}}, "not": {"required": ["notebook"]}}]},
        {"allOf": [{"$ref": "#/$defs/problem"}, {"properties": {"problem_id": {"const": "O005-BRIDGE-C1-P05"}, "ordinal": {"const": 5}}, "not": {"required": ["notebook"]}}]},
        {"allOf": [{"$ref": "#/$defs/problem"}, {"properties": {"problem_id": {"const": "O005-BRIDGE-C1-P06"}, "ordinal": {"const": 6}}, "not": {"required": ["notebook"]}}]},
        {"allOf": [{"$ref": "#/$defs/problem"}, {"properties": {"problem_id": {"const": "O005-BRIDGE-C1-P07"}, "ordinal": {"const": 7}}, "required": ["notebook"]}]}
      ],
      "items": false
    }
  },
  "$defs": {
    "nonemptyString": {"type": "string", "minLength": 1},
    "provenance": {
      "type": "object",
      "additionalProperties": false,
      "required": ["problem_summary", "hint", "check", "solution_or_rubric"],
      "properties": {
        "problem_summary": {"const": "new_original"},
        "hint": {"const": "new_original"},
        "check": {"const": "new_original"},
        "solution_or_rubric": {"const": "new_original"}
      }
    },
    "hint": {
      "type": "object",
      "additionalProperties": false,
      "required": ["text"],
      "properties": {"text": {"$ref": "#/$defs/nonemptyString"}}
    },
    "tolerances": {
      "type": "object",
      "additionalProperties": false,
      "minProperties": 1,
      "properties": {
        "absolute_c": {"type": "number", "exclusiveMinimum": 0},
        "k_absolute": {"type": "number", "exclusiveMinimum": 0},
        "temperature_absolute_c": {"type": "number", "exclusiveMinimum": 0},
        "metric_absolute_c": {"type": "number", "exclusiveMinimum": 0}
      }
    },
    "check": {
      "type": "object",
      "additionalProperties": false,
      "required": ["type", "final_answer"],
      "properties": {
        "type": {"enum": ["qualitative", "structured", "quantitative", "executable"]},
        "final_answer": {"$ref": "#/$defs/nonemptyString"},
        "required_evidence": {
          "type": "array", "minItems": 1,
          "items": {"$ref": "#/$defs/nonemptyString"}
        },
        "tolerances": {"$ref": "#/$defs/tolerances"},
        "formula": {"$ref": "#/$defs/nonemptyString"},
        "notebook_check": {"$ref": "#/$defs/nonemptyString"}
      },
      "allOf": [
        {
          "if": {"properties": {"type": {"enum": ["qualitative", "structured"]}}},
          "then": {"required": ["required_evidence"]}
        },
        {
          "if": {"properties": {"type": {"const": "quantitative"}}},
          "then": {
            "anyOf": [
              {"required": ["required_evidence"]},
              {"required": ["formula", "tolerances"]}
            ]
          }
        },
        {
          "if": {"properties": {"type": {"const": "executable"}}},
          "then": {"required": ["notebook_check", "required_evidence", "tolerances"]}
        }
      ]
    },
    "solution": {
      "type": "object",
      "additionalProperties": false,
      "required": ["type", "steps", "conclusion"],
      "properties": {
        "type": {"const": "worked_solution"},
        "steps": {
          "type": "array", "minItems": 1,
          "items": {"$ref": "#/$defs/nonemptyString"}
        },
        "conclusion": {"$ref": "#/$defs/nonemptyString"}
      }
    },
    "notebook": {
      "type": "object",
      "additionalProperties": false,
      "required": ["path", "provenance"],
      "properties": {
        "path": {"const": "source/id-ID/O005-BRIDGE-C1/notebooks/bridge-c1-reproducible-workflow.ipynb"},
        "provenance": {"const": "new_original"}
      }
    },
    "problem": {
      "type": "object",
      "additionalProperties": false,
      "required": [
        "problem_id", "ordinal", "problem_summary", "article_link_ids",
        "source_formula_occurrences", "provenance", "hint", "check", "solution_or_rubric"
      ],
      "properties": {
        "problem_id": {"type": "string", "pattern": "^O005-BRIDGE-C1-P0[1-7]$"},
        "ordinal": {"type": "integer", "minimum": 1, "maximum": 7},
        "problem_summary": {"$ref": "#/$defs/nonemptyString"},
        "article_link_ids": {"type": "array", "maxItems": 0},
        "source_formula_occurrences": {
          "type": "array", "uniqueItems": true,
          "items": {"$ref": "#/$defs/nonemptyString"}
        },
        "provenance": {"$ref": "#/$defs/provenance"},
        "hint": {"$ref": "#/$defs/hint"},
        "check": {"$ref": "#/$defs/check"},
        "solution_or_rubric": {"$ref": "#/$defs/solution"},
        "notebook": {"$ref": "#/$defs/notebook"}
      }
    }
  }
}
